{
  "$schema": "network-log/1.0",
  "schema_version": "1.0",
  "app": "Heartful Baby",
  "package_name": "com.heartfulsprout.baby",
  "capture_date": "2026-08-12",
  "capture": "results/heartful-baby-test-20260812/artifacts/captures/Heartful-baby.mitm",
  "redaction": "Query strings, headers, and bodies stripped. Project numbers and subscriber IDs replaced with [REDACTED].",
  "flows": [
    {
      "method": "GET",
      "host": "connectivitycheck.gstatic.com",
      "path": "/generate_204",
      "status": 204,
      "origin": "android system"
    },
    {
      "method": "GET",
      "host": "www.google.com",
      "path": "/generate_204",
      "status": 204,
      "origin": "android system"
    },
    {
      "method": "GET",
      "host": "connectivitycheck.gstatic.com",
      "path": "/generate_204",
      "status": 204,
      "origin": "android system"
    },
    {
      "method": "GET",
      "host": "www.google.com",
      "path": "/generate_204",
      "status": 204,
      "origin": "android system"
    },
    {
      "method": "POST",
      "host": "firebaselogging.googleapis.com",
      "path": "/v0cc/log/batch",
      "status": 200,
      "origin": "app"
    }
  ],
  "summary": {
    "total_flows": 5,
    "unique_destinations": [
      "connectivitycheck.gstatic.com",
      "firebaselogging.googleapis.com",
      "www.google.com"
    ],
    "tracked": "Hosts listed are carriers of tracking or analytics SDKs (Facebook, Firebase, RevenueCat, Crashlytics, FCM). Font and system checks are marked by origin."
  }
}
