{
  "$schema": "network-log/1.0",
  "schema_version": "1.0",
  "app": "fixture",
  "package_name": "com.example.fixture",
  "capture_date": "2026-08-14",
  "capture": "/var/folders/lq/dh7fn5ds7sb9w7kr_5bc823r0000gn/T//network-log-redaction-test.55hH5c/input.mitm",
  "redaction": "Query strings removed; token-like path segments replaced by [REDACTED]; body values, headers, and cookies never included; body JSON keys only.",
  "flows": [
    {
      "method": "POST",
      "host": "analytics.example",
      "path": "https://analytics.example/track/[REDACTED]",
      "status": 200,
      "origin": "app",
      "count": 1,
      "request": {
        "size": 55,
        "content_type": "application/json",
        "body_keys": [
          "baby_name",
          "token"
        ],
        "headers": [
          "authorization"
        ]
      },
      "response": {
        "size": 40,
        "content_type": "application/json",
        "body_keys": [
          "ok",
          "token"
        ]
      }
    }
  ],
  "summary": {
    "total_flows": 1,
    "unique_destinations": [
      "analytics.example"
    ]
  }
}
